{
  "schema_version": 1,
  "contract_id": "ogc-tiles-dggs",
  "source_digest": "sha256:8d8d5059e1e01f8f482e3ef4ff7ef0c0c19ce6a7cda9adb7a1c1f16e8a2ee75c",
  "reviewed_at": "2026-07-27",
  "owner": "Jose Mocito",
  "operations": [
    {
      "target_id": "ogc-tiles-dggs:DGGS discovery/retrieval",
      "effect": "protocol",
      "retry": "safe",
      "evidence": "ogc-tiles-dggs source sha256:8d8d5059e1e01f8f482e3ef4ff7ef0c0c19ce6a7cda9adb7a1c1f16e8a2ee75c; owner classification 2026-07-27",
      "access": "requires-access",
      "disposition": "excluded-permanent",
      "reason": "Tiles returns HTTP 500 and DGGS has no usable collections"
    },
    {
      "target_id": "ogc-tiles-dggs:Tiles discovery/retrieval",
      "effect": "protocol",
      "retry": "safe",
      "evidence": "ogc-tiles-dggs source sha256:8d8d5059e1e01f8f482e3ef4ff7ef0c0c19ce6a7cda9adb7a1c1f16e8a2ee75c; owner classification 2026-07-27",
      "access": "requires-access",
      "disposition": "excluded-permanent",
      "reason": "Tiles returns HTTP 500 and DGGS has no usable collections"
    }
  ]
}
