{
  "schema_version": 1,
  "contract_id": "route",
  "source_digest": "sha256:afe9c23e037be9609ea0eb12c3b4c76c2be0a3ab4469eafd5e3a502729bb081a",
  "reviewed_at": "2026-07-27",
  "owner": "Jose Mocito",
  "operations": [
    {
      "target_id": "route:GET /api/Matrix",
      "effect": "query",
      "retry": "safe",
      "evidence": "route source sha256:afe9c23e037be9609ea0eb12c3b4c76c2be0a3ab4469eafd5e3a502729bb081a; owner classification 2026-07-27",
      "access": "public-anonymous",
      "disposition": "curated-command",
      "command": [
        "route matrix"
      ]
    },
    {
      "target_id": "route:GET /api/Route/best",
      "effect": "query",
      "retry": "safe",
      "evidence": "route source sha256:afe9c23e037be9609ea0eb12c3b4c76c2be0a3ab4469eafd5e3a502729bb081a; owner classification 2026-07-27",
      "access": "public-anonymous",
      "disposition": "curated-command",
      "command": [
        "route calculate"
      ]
    },
    {
      "target_id": "route:GET /api/Route/bike",
      "effect": "query",
      "retry": "safe",
      "evidence": "route source sha256:afe9c23e037be9609ea0eb12c3b4c76c2be0a3ab4469eafd5e3a502729bb081a; owner classification 2026-07-27",
      "access": "public-anonymous",
      "disposition": "curated-command",
      "command": [
        "route calculate"
      ]
    },
    {
      "target_id": "route:GET /api/Route/bruksklasse12100",
      "effect": "query",
      "retry": "safe",
      "evidence": "route source sha256:afe9c23e037be9609ea0eb12c3b4c76c2be0a3ab4469eafd5e3a502729bb081a; owner classification 2026-07-27",
      "access": "public-anonymous",
      "disposition": "curated-command",
      "command": [
        "route calculate"
      ]
    },
    {
      "target_id": "route:GET /api/Route/bruksklasse1265",
      "effect": "query",
      "retry": "safe",
      "evidence": "route source sha256:afe9c23e037be9609ea0eb12c3b4c76c2be0a3ab4469eafd5e3a502729bb081a; owner classification 2026-07-27",
      "access": "public-anonymous",
      "disposition": "curated-command",
      "command": [
        "route calculate"
      ]
    },
    {
      "target_id": "route:GET /api/Route/bruksklasseModulvognTog",
      "effect": "query",
      "retry": "safe",
      "evidence": "route source sha256:afe9c23e037be9609ea0eb12c3b4c76c2be0a3ab4469eafd5e3a502729bb081a; owner classification 2026-07-27",
      "access": "public-anonymous",
      "disposition": "curated-command",
      "command": [
        "route calculate"
      ]
    },
    {
      "target_id": "route:GET /api/Route/bruksklasseNormalTransport",
      "effect": "query",
      "retry": "safe",
      "evidence": "route source sha256:afe9c23e037be9609ea0eb12c3b4c76c2be0a3ab4469eafd5e3a502729bb081a; owner classification 2026-07-27",
      "access": "public-anonymous",
      "disposition": "curated-command",
      "command": [
        "route calculate"
      ]
    },
    {
      "target_id": "route:GET /api/Route/bruksklasseSpesialTransport",
      "effect": "query",
      "retry": "safe",
      "evidence": "route source sha256:afe9c23e037be9609ea0eb12c3b4c76c2be0a3ab4469eafd5e3a502729bb081a; owner classification 2026-07-27",
      "access": "public-anonymous",
      "disposition": "curated-command",
      "command": [
        "route calculate"
      ]
    },
    {
      "target_id": "route:GET /api/Route/bruksklasseTommerTransport",
      "effect": "query",
      "retry": "safe",
      "evidence": "route source sha256:afe9c23e037be9609ea0eb12c3b4c76c2be0a3ab4469eafd5e3a502729bb081a; owner classification 2026-07-27",
      "access": "public-anonymous",
      "disposition": "curated-command",
      "command": [
        "route calculate"
      ]
    },
    {
      "target_id": "route:GET /api/Route/tourist",
      "effect": "query",
      "retry": "safe",
      "evidence": "route source sha256:afe9c23e037be9609ea0eb12c3b4c76c2be0a3ab4469eafd5e3a502729bb081a; owner classification 2026-07-27",
      "access": "public-anonymous",
      "disposition": "curated-command",
      "command": [
        "route calculate"
      ]
    },
    {
      "target_id": "route:POST /api/RoadFeature/roadFeatures",
      "effect": "query",
      "retry": "safe",
      "evidence": "route source sha256:afe9c23e037be9609ea0eb12c3b4c76c2be0a3ab4469eafd5e3a502729bb081a; owner classification 2026-07-27",
      "access": "public-anonymous",
      "disposition": "curated-command",
      "command": [
        "route road-feature query"
      ]
    },
    {
      "target_id": "route:POST /api/RoadFeature/roadFeaturesWithBruksklasse",
      "effect": "query",
      "retry": "safe",
      "evidence": "route source sha256:afe9c23e037be9609ea0eb12c3b4c76c2be0a3ab4469eafd5e3a502729bb081a; owner classification 2026-07-27",
      "access": "public-anonymous",
      "disposition": "curated-command",
      "command": [
        "route road-feature query"
      ]
    }
  ]
}
